{
    "name": {
        "ara": "قَدْ كَفَانِي",
        "en": "Qad Kafani - (My Lord) Sufficed for me"
    },
    "verses": {
        "ara": [
            "قَدْ كَفَانِي عِلْمُ رَبِّي",
            "مِنْ سُؤَالِي وَاخْتِيَارِي",
            "فَدُعَائِي وَابْتِهَالِي",
            "شَاهِدٌلِي بِافْتِقَارِي",

            "فَلِهَذَا السِّرِّ أَدْعُو",
            "فِي يَسَارِي وَعِسَارِي",
            "أَنَا عَبْدٌ صَارَ فَخْرِي",
            "ضِمْنَ فَقْرِي وَاضْطِرَارِي",

            "يَا إِلَهِي وَمَلِيكِي",
            "أَنْتَ تَعْلَمْ كَيْفَ حَالِي",
            "وَبِمَا قَدْ حَلَّ قَلْبِي",
            "مِنْ هُمُومٍ وَاشْتِغَالِي",

            "فَتَدَارَكْنِي بِلُطْفٍ",
            "مِنْكَ يَامَوْلَى الْمَوَالِي",
            "يَاكَرِيمَ الْوَجْهِ غِثْنِي",
            "قَبْلَ أَنْ يَفْنَى اصْطِبَارِي",

            "يَاسَرِيعَ الْغَوْثِ غَوْثًا",
            "مِنْكَ يُدْرِكْنَا سَرِيعًا",
            "يَهْزِمُ الْعُسْرَ وَيَأْتِي",
            "بِالَّذِي أَرْجُو جَمِيعًا",

            "يَاقَرِيبًا يَامُجِيبًا",
            "يَاعَلِيمًا يَاسَمِيعًا",
            "قَدْ تَحَقَّقْتُ بِعَجْزِي",
            "وَخُضُوعِي وَانْكِسَارِي",

            "لَمْ أَزَلْ بِالْبَابِ وَاقِفْ",
            "فَارْحَمَنْ رَبِّي وُقُوفِي",
            "وَبِوَادِي الْفَضْلِ عَاكِفْ",
            "فَأَدِمْ رَبِّي عُكُوفِي",

            "وَلِحُسْنِ الظَّنِّ أُلَازِمْ",
            "فَهْوَ خِلِّي وَحَلِيفِي",
            "وَأَنِيسِي وَجَلِيسِي",
            "طُولَ لَيْلِي وَنَهَارِي",

            "حَاجَةً فِي النَّفْسِ يَارَبْ",
            "فَاقْضِهَا يَا خَيْرَ قَاضِي",
            "وَأَرِحْ سِرِّي وَقَلْبِي",
            "مِنْ لَظَاهَا وَالشُّوَاظِ",

            "فِي سُرُورٍ وَحُبُورٍ",
            "وَإِذَا مَاكُنْتَ رَاضِي",
            "فَالْهَنَا وَالْبَسْطُ حَالِي",
            "وَشِعَارِي وَدِثَارِي"
        ],
        "en": [
            "Qad kafaanee ‘ilmu Rabbi,",
            "min su-aalee wakhtiyaaree",
            "Fadu’aa-ee wabtihaalee,",
            "shaahidunlee biftiqaaree",

            "Falihaadhas sirri -ad’oo,",
            "fi yasaaree wa ‘isaaree",
            "-Anaa ‘abdun saara fakharee,",
            "dimna faqree wad tiraaree",

            "Yaa -ilaahee wa maleekee,",
            "-anta ta’lam kayfa Haalee",
            "Wa bimaa qad Halla qalbee,",
            "min humoomin washtighaalee",

            "Fataadaraknee bilutfin,",
            "minka yaa Mawlal mawaalee",
            "Yaa kareemal wajhi ghithnee,",
            "qabla -an yafnas tibaaree",

            "Yaa saree’al ghauthi ghauthan,",
            "minka yudriknaa saree’an",
            "Yahzimul ‘usra wa ya-tee,",
            "billadhee -arjoo jamee’an",

            "Yaa qareeban yaa mujeeban,",
            "yaa ‘aleeman yaa samee’an",
            "Qad taHaqqaqtu bi’ajzee,",
            "wa khudu’ee wankisaaree",

            "Lam -azal bilbaabi waaqif,",
            "farHaman Rabbi wuqoofee",
            "Wa biwaadil fadli ‘aakif,",
            "fa-adim Rabbi ‘ukoofee",

            "Wa liHusnizh zhanni -ulaazim,",
            "fahwa khillee wa Haleefee",
            "Wa -aneesee wa jaleesee,",
            "toola laylee wa nahaaree",

            "Haajatan finnafsi yaa Rab,",
            "faqdihaa yaa khayra qaadee",
            "Wa -ariH sirree wa qalbee,",
            "min lazhaahaa wash shuwaazhi",

            "Fi suroorin wa Huboorin,",
            "wa -idhaa maa kunta raadee",
            "Falhanaa walbastu Haalee,",
            "wa shi’aaree wa dithaaree"
        ]
    },
    "translation": {
        "en": [
            "My Lord’s knowledge has sufficed me",
            "from requesting and choosing",
            "My prayer and my supplication",
            "are a witness to my impoverishment",

            "By this secret I supplicate,",
            "in times of ease and hardship",
            "I am a slave who has become proud",
            "in his poverty and desperation (in Allah)",

            "O My Lord, my King,",
            "You know my state",
            "And what has settled in my heart",
            "from worries and preoccupations",

            "So restore me with gentle grace",
            "from You, O Master of masters!",
            "O Most Generous One, save me",
            "before I exhaust my patience (with myself)!",

            "O Swift in granting aid! Grant me aid",
            "from you, which will reach me swiftly",
            "Vanquishing all difficulty, and bringing",
            "The fulfillment of all that I hope for",

            "O Most Near! O Responder (to supplications)!",
            "All-Knowing! All-Hearing One!",
            "I have realised my incapacity,",
            "lowliness and utter brokenness",

            "I remain standing by Your door,",
            "so have mercy my Lord on my standing",
            "And so I devote myself to the valley of grace,",
            "make my devotion everlasting O Lord!",

            "A good opinion (of my Lord) is binding,",
            "for He is my Close Friend, my Ally",
            "My Intimate Companion,",
            "who sits with me throughout the day and the night",

            "The need in my soul, O Lord!",
            "fulfil it, O Best of those who fulfil!",
            "And ease my inner essence (soul) and my heart",
            "from the burning fire inside them",

            "If You are pleased (with me)",
            "in happiness and in joy!",
            "Then bliss and expansion are my state,",
            "my slogan and my covering"
        ]
    },
    "order": {
        "chorus": [
            [
                { "repeat": 1, "index": 0 },
                { "repeat": 1, "index": 1 },
                { "repeat": 1, "index": 2 },
                { "repeat": 1, "index": 3 }
            ]
        ],
        "verses": [
            [
                { "repeat": 1, "index": 4 },
                { "repeat": 1, "index": 5 },
                { "repeat": 1, "index": 6 },
                { "repeat": 1, "index": 7 }
            ],
            [
                { "repeat": 1, "index": 8 },
                { "repeat": 1, "index": 9 },
                { "repeat": 1, "index": 10 },
                { "repeat": 1, "index": 11 }
            ],
            [
                { "repeat": 1, "index": 12 },
                { "repeat": 1, "index": 13 },
                { "repeat": 1, "index": 14 },
                { "repeat": 1, "index": 15 }
            ],
            [
                { "repeat": 1, "index": 16 },
                { "repeat": 1, "index": 17 },
                { "repeat": 1, "index": 18 },
                { "repeat": 1, "index": 19 }
            ],
            [
                { "repeat": 1, "index": 20 },
                { "repeat": 1, "index": 21 },
                { "repeat": 1, "index": 22 },
                { "repeat": 1, "index": 23 }
            ],
            [
                { "repeat": 1, "index": 24 },
                { "repeat": 1, "index": 25 },
                { "repeat": 1, "index": 26 },
                { "repeat": 1, "index": 27 }
            ],
            [
                { "repeat": 1, "index": 28 },
                { "repeat": 1, "index": 29 },
                { "repeat": 1, "index": 30 },
                { "repeat": 1, "index": 31 }
            ],
            [
                { "repeat": 1, "index": 32 },
                { "repeat": 1, "index": 33 },
                { "repeat": 1, "index": 34 },
                { "repeat": 1, "index": 35 }
            ],
            [
                { "repeat": 1, "index": 36 },
                { "repeat": 1, "index": 37 },
                { "repeat": 1, "index": 38 },
                { "repeat": 1, "index": 39 }
            ]
        ]
    }
}
