{
    "name": {
        "ara": "القَصِيدَةُ الْفِيْأَشِيَّة",
        "en": "Qasīda Fiyashiyya - I Have Not a Thing"
    },
    "verses": {
        "ara": [
            "أَنَا عَبْدُ رَبِّي لَهُ قُدْرَةٌ",
            "يَهُونُ بِهَا كُلُّ أَمْرٍ عَسِيرْ",
            "فَإِنْ كَنْتُ عَبْدً ضَعِيفَ الْقُوَّى",
            "فَرَبِّي عَلَى كُلِّ شَيْءٍ قَدِيرْ",

            "مِنِّي اَشَ عْلَيَّا",
            "وَنَا عَبْدٌ مَمْلُوكْ",

            "وَالْأَشْيَا مَقْضِيَّا",
            "مَا فِى التَّحْقِيقْ شُكُوكْ",

            "رَبِّي نَاظَرْ فِيَّا",
            "وَنَا نَظْرِي مَتْرُوكْ",

            "فِي الْأَرْحَمْ وَالْحَاشَا",
            "مِنْ نُّطْفَا صَوَّرْنِي",

            "أَنَا مَالِي فِيَاشْ",
            "اَشَ عْلَيَّا مِنِّي",

            "نَقْلَقْ مِنْ رِّزٔقِي لَاشْ",
            "وَالْخَالِقْ يَرْزَقْنِي",

            "اللّهُمَّ صَلِّ عَلَى الْمُصْطَفَى",
            "حَبِيبْنَا مُحَمَّدْ عَلَيْهِ السَّلَام",

            "يَقُولُ لِمَا شَاءَ كُنْ فَيَكُونْ",
            "وَيُبْدِءُ سُبْحَانَهُ وَيُعِيدْ",
            "وَيَحْكُمُ فِي خَلْقِهِ مَا يَشَاء",
            "وَيَفْعَلُ فِي مُلْكِهِ مَا يَرِيدْ",

            "فِي ظُلْمَةِ الْأَرْحَامْ",
            "صَوَّرْنِي مِنْ نُّطْفَ",

            "وَبْدَانِي بِا الْإِنْعَامْ",
            "نِعْمَةْ مِنْ كُلْ صَنْفَا",

            "وَخْلَقْ لِي مَا وَطْعَامْ",
            "وَنْعَايَمْ مَخْتَلْفَا",

            "وَازْدَتْ مِنْ غَيرْ قَمَاشْ",
            "غَطَّانِي وَسْتَرْنِي"
        ],
        "en": [
            "Ana ‘abdu Rabbī lahū qudratun",
            "Yahūnu bihā kullu ’amrin ‘asīr",
            "Fa-’in kuntu ‘abdan ḍa‘īfa-lquwā",
            "Fa-Rabbī ‘alā kulli shay’in qadīr",

            "Minnī asha’ layyā",
            "Wa nā ‘abadun mamlūk",

            "Wa-l-’ashyā’ maqḍīya",
            "Mā fi t-taḥqīq shukūk",

            "Rabbī nāẓir fiyā",
            "Wa ana naẓarī matrūk",

            "Fi l-’arḥām wa l-’aḥshā’",
            "Min nuṭfa ṣawwaranī",

            "Ana mā lī fiyāsh",
            "Asha‘ layyā minnī",

            "Naqlaq mir-rizqī lāsh",
            "Wa-lKhāliq yarzuqnī",

            "Allāhumma ṣalli ‘ala l-Muṣṭafā",
            "Ḥabībnā Muḥammad ‘alayhi s-salām",

            "Yaqūlu limā shā-a kun fayakūn",
            "Wa yubdi-u subhānahu wa yu’īd",
            "Wa yahkumu fī khalqihi mā yashā’",
            "Wa yaf’alu fī mulkihi mā yarīd",

            "Fī zulmati-l-arhām",
            "Sawwarnī min-nutfa",

            "Wabdānī bi-l-in’ām",
            "Ni’mat min kul sanfā",

            "Wakhlaq lī mā wat’ām",
            "Wan’āyam makhtalfā",

            "Wazdat min ghayr qamāsh",
            "Ghattānī wastarnī"
        ]
    },
    "translation": {
        "en": [
            "A humble slave am I of an almighty Lord",
            "No work is too hard for that One who’s adored",
            "But though I’m a beggar who cannot afford",
            "To claim any strength, sure and strong is my Lord",

            "I’m but a humble slave,",
            "What should I worry about?",

            "All affairs are ordained,",
            "Of this there is no doubt",

            "My Lord sees everything,",
            "While my sight leaves much out",

            "In the womb",
            "He formed me from a drop",

            "I haven’t got the force,",
            "No strength between my sides",

            "Why feel such remorse",
            "When the Maker provides?",

            "O Allah, send your blessings on The Chosen One,",
            "Our Beloved Muhammad, Peace be upon Him",

            "He says, where He wills, when He wishes a thing, just “Be”, and it is,",
            "by the might of a King.",
            "The ruler whose edicts and wise rulings bring",
            "All blessings and grace by the might of a King.",

            "In darkness of the womb,",
            "He shaped me from drop",

            "He gave me from His grace,",
            "all favours pure and good",

            "Created food and water,",
            "and gave all luxuries",

            "I came down all naked",
            "He clothed and covered me"
        ]
    },
    "order": {
        "chorus": [],
        "verses": [
            [
                { "repeat": 1, "index": 0 },
                { "repeat": 1, "index": 1 },
                { "repeat": 1, "index": 2 },
                { "repeat": 1, "index": 3 }
            ],
            [
                { "repeat": 1, "index": 4 },
                { "repeat": 1, "index": 5 }
            ],
            [
                { "repeat": 1, "index": 6 },
                { "repeat": 1, "index": 7 }
            ],
            [
                { "repeat": 1, "index": 8 },
                { "repeat": 1, "index": 9 }
            ],
            [
                { "repeat": 1, "index": 10 },
                { "repeat": 1, "index": 11 }
            ],
            [
                { "repeat": 1, "index": 12 },
                { "repeat": 1, "index": 13 }
            ],
            [
                { "repeat": 1, "index": 14 },
                { "repeat": 1, "index": 15 }
            ],
            [
                { "repeat": 1, "index": 16 },
                { "repeat": 1, "index": 17 }
            ],
            [
                { "repeat": 1, "index": 18 },
                { "repeat": 1, "index": 19 },
                { "repeat": 1, "index": 20 },
                { "repeat": 1, "index": 21 }
            ],
            [
                { "repeat": 1, "index": 22 },
                { "repeat": 1, "index": 23 }
            ],
            [
                { "repeat": 1, "index": 24 },
                { "repeat": 1, "index": 25 }
            ],
            [
                { "repeat": 1, "index": 26 },
                { "repeat": 1, "index": 27 }
            ],
            [
                { "repeat": 1, "index": 28 },
                { "repeat": 1, "index": 29 }
            ],
            [
                { "repeat": 1, "index": 12 },
                { "repeat": 1, "index": 13 }
            ],
            [
                { "repeat": 1, "index": 14 },
                { "repeat": 1, "index": 15 }
            ],
            [
                { "repeat": 1, "index": 16 },
                { "repeat": 1, "index": 17 }
            ]
        ]
    }
}
