{
    "name": {
        "ara": "كن مع الله تر الله معك",
        "en": "Kun Ma'a Llāhi Tarā Llāha Maʿak - Be with God and you will see God with you"
    },
    "verses": {
        "ara": [
            "لَا إلَهَ إلَا اللهْ اللهْ اللهْ",
            "وَالصَلَاةْ عَلَى مَولَيْ رَسُولِ اللهْ",

            "كُنْ مَعَ اللهِ تَرَ اللهَ مَعَكْ",
            "وَاتْرُكِ الكُلَّ وَحَاذِرْ طَمَعَكْ",

            "ثُمَّ ضَعْ نَفْسَكَ بِالْذُلِ لَهُ",
            "قَبْلَ أَنَ النَفْسَ قَهْراً تَضَعَكْ",

            "وَالزَمِ القَنْعَ بِمَنْ أَنْتَ لَهُ",
            "فِي جَمِيْعِ الكَوْنِ حَتَّى يَسَعَكْ",

            "وَإِذَا أَعْطَاكَ مَنْ يَمْنَعُهُ",
            "ثُمَّ مَنْ يُعْطِيْ إِذَا مَا مَنَعَكْ",

            "لَا تُؤَمِّلْ مِنْ سِوَاهُ أَمَلاً",
            "إِنَّمَا يَسْقِيْكَ مَنْ قَدْ زَرَعَكْ",

            "وَدَعِ التَدْبِيْرَ فِي الأَمْرِ لَهُ",
            "وَاصْنَعِ المَعْرُوفَ مَعْ مَنْ صَنَعَكْ",

            "نُورُكَ اللهُ بِهِ كُنْ مُشْرِقاً",
            "وَاحْذَرِ الأَضْدَادَ تُطْفِيْ شُمَعَكْ",

            "وَاعْبُدِ اللهَ بِكَشْفٍ وَاصْطَبِرْ",
            "وَعَلَى الكَشْفِ تَوَقَّى جَزَعَكْ",

            "لَا تَقُلْ لَمْ يَفْتَحِ اللهُ وَلَا",
            "تَطْلُبِ الفَتْحَ وَحَرِّرْ وَرَعَكْ",

            "كُلَّمَا نَابَكَ أَمْرٌ ثِقْ بِهِ",
            "وَاحْتَرِزْ لِلْغَيْرِ تَشْكُو وَجَعَكْ",

            "إِنَّمَا أَنْتَ لَهُ عَبْدٌ فَكُنْ",
            "جَاعِلاً فِي القُرْبِ مِنْهُ وَلَعَكْ",

            "فُزْ بِوَصْلٍ إِنْ تَرَاهُ وَاصِلاً",
            "وَاقْبَلِ القَطْعَ إِذَا مَا قَطَعَكْ"
        ],
        "en": [
            "lā ilāha illā Allāh Allāh Allāh",
            "waṣ-ṣalāh ʿalā mawlāy rasūli llāh",

            "kun maʿa llāhi tarā llāha maʿak",
            "wa-utruk al-kulla wa-ḥādhir ṭamaʿak",

            "thumma ḍaʿ nafsaka bil-dhulli lahu",
            "qabla an nafsu qahran taḍaʿak",

            "walzam al-qanʿa biman anta lahu",
            "fī jamīʿi l-kawni ḥattā yasaʿak",

            "wa-idhā aʿṭāka man yamnaʿuhu",
            "thumma man yuʿṭī idhā mā manaʿak",

            "lā tuʾammil min siwāhu amala",
            "innamā yusqīka man qad zaraʿak",

            "wa-daʿ at-tadbīra fī l-amri lahu",
            "wa-ṣnaʿ al-maʿrūfa maʿa man ṣanaʿak",

            "nūruka llāhu bihi kun mushriqan",
            "waḥdhar al-aḍdāda tuṭfī shumaʿak",

            "wa-ʿbud llāha bi-kashfin wa-ṣṭabir",
            "wa-ʿalā l-kashfi tawāqqā jazaʿak",

            "lā taqul lam yaftaḥi llāhu walā",
            "taṭlub al-fatḥa wa-ḥarrir waraʿak",

            "kullamā nābaka amrun thiq bihi",
            "waḥtariz lil-ghayri tashkū wajaʿak",

            "innamā anta lahu ʿabdun fa-kun",
            "jāʿilan fī l-qurbi minhu walaʿak",

            "fuz bi-waṣlin in tarāhu wāṣilan",
            "wa-qbal al-qaṭʿa idhā mā qaṭaʿak"
        ]
    },
    "translation": {
        "en": [
            "There is no deity but Allah, Allah, Allah,",
            "And prayers upon my master, the Messenger of Allah.",

            "Be with God and you will see God with you",
            "forsake everything and beware of your greed",

            "Then humble yourself before Him",
            "before your ego humiliates you forcefully",

            "Be content with what He has given you",
            "for it encompasses the entirety of the universe",

            "If He grants you something, who can withhold it",
            "and if He withholds, who can give it to you",

            "Do not hope for anything from anyone else",
            "Only the One who planted (created) you can water (provide to) you",

            "Leave the planning of matters to Him",
            "and do good to the One who has done good to you",

            "Let God's light shine through you",
            "and beware of 'others' that extinguish your light",

            "Worship God through unveiling and be patient",
            "and avoid despair in times of veiling",

            "Do not say God has not given openings",
            "and do not ask for openings and be sincere",

            "Whenever you face a hardship, trust in Him",
            "avoid complaining to others about your pain",

            "You are His servant, so be",
            "making your closeness to Him your passion",

            "Seize the connection with Him when it arises,",
            "and gracefully accept when He severs it"
        ]
    },
    "order": {
        "chorus": [
            [
                { "repeat": 1, "index": 0 },
                { "repeat": 2, "index": 1 }
            ]
        ],
        "verses": [
            [
                { "repeat": 1, "index": 2 },
                { "repeat": 2, "index": 3 }
            ],
            [
                { "repeat": 1, "index": 4 },
                { "repeat": 2, "index": 5 }
            ],
            [
                { "repeat": 1, "index": 6 },
                { "repeat": 2, "index": 7 }
            ],
            [
                { "repeat": 1, "index": 8 },
                { "repeat": 2, "index": 9 }
            ],
            [
                { "repeat": 1, "index": 10 },
                { "repeat": 2, "index": 11 }
            ],
            [
                { "repeat": 1, "index": 12 },
                { "repeat": 2, "index": 13 }
            ],
            [
                { "repeat": 1, "index": 14 },
                { "repeat": 2, "index": 15 }
            ],
            [
                { "repeat": 1, "index": 16 },
                { "repeat": 2, "index": 17 }
            ],
            [
                { "repeat": 1, "index": 18 },
                { "repeat": 2, "index": 19 }
            ],
            [
                { "repeat": 1, "index": 20 },
                { "repeat": 2, "index": 21 }
            ],
            [
                { "repeat": 1, "index": 22 },
                { "repeat": 2, "index": 23 }
            ],
            [
                { "repeat": 1, "index": 24 },
                { "repeat": 2, "index": 25 }
            ]
        ]
    }
}
